author,publishdate,title,description,upvote
Hafsa Jabeen,"August 21st, 2018",Market Basket Analysis using R,Learn about Market Basket Analysis & the APRIORI Algorithm that works behind it. You'll see how it is helping retailers boost business by predicting what items customers buy together.,65
Saneep Khatri,"August 21st, 2018",Analyzing Complexity of Code through Python,"Get introduced to Asymptotic Analysis. Learn more about the complexity of the algorithm as well as asymptotic notation, such as Big O, Big θ, and Big Ω notation. Along with the examples of complexity in a different algorithm.",14
Nishant Singh,"August 20th, 2018",Data Visualization with Highcharter in R,Learn how to use Highcharter to create a visualization that creates a buzz.,19
Kyle Weller,"August 17th, 2018",Remote Python and R in SQL,Learn how to remotely send R and Python execution to a SQL Server from Jupyter Notebooks.,8
Derrick Mwiti,"August 16th, 2018",Dash for Beginners,Learn how to build dashboards in Python using Dash.,61
Sayak  Paul,"August 15th, 2018",Hyperparameter Optimization in Machine Learning Models,This tutorial covers what a parameter and a hyperparameter are in a machine learning model along with why it is vital in order to enhance your model’s performance.,43
Avinash Navlani,"August 14th, 2018",Predicting Employee Churn in Python,"Analyze employee churn. Find out why employees are leaving the company, and learn to predict who will leave the company.",53
Rohit Peesa,"August 13th, 2018",Datasets from Images,"This tutorial will demonstrate how you can make datasets in CSV format from images and use them for Data Science, on your laptop.",13
Luke Hayden,"August 9th, 2018",Principal Component Analysis in R,"In this tutorial, you'll learn how to use PCA to extract data with many variables and create visualizations to display that data.",178
Sejal Jaiswal,"August 8th, 2018","Python IF, ELIF, and ELSE Statements","In this tutorial, you will learn exclusively about Python if else statements.",16
Keith Singleton,"August 7th, 2018",MeetUp API,"In this tutorial, you’ll learn how to pull data directly from MeetUp’s API using Python and write it into a JSON.",10
Aditya Sharma,"August 6th, 2018",Image Super-Resolution using Multi-Decoder Framework,"In this tutorial, you’ll implement a medical imaging using deep learning paper with Python in Keras.",12
Sayak  Paul,"August 3rd, 2018",DBSCAN: A Macroscopic Investigation in Python,"Cluster analysis is an important problem in data analysis. Data scientists use clustering to identify malfunctioning servers, group genes with similar expression patterns, or various other applications.",21
Avinash Navlani,"August 2nd, 2018",KNN Classification using Scikit-learn,Learn K-Nearest Neighbor(KNN) Classification and build KNN classifier using Python Scikit-learn package.,63
Carlos Zelada,"July 31st, 2018",Bivariate Distribution Heatmaps in R,"Learn how to visually show the relationship between two features, how they interact with each other, and where data points are concentrated.",12
Abhishek Kasireddy,"July 31st, 2018",Scraping Reddit with Python and BeautifulSoup 4,"In this tutorial, you'll learn how to get web pages using requests, analyze web pages in the browser, and extract information from raw HTML with BeautifulSoup.",21
Kyle Weller,"July 30th, 2018",How to Execute Python/R in SQL,"After reading this tutorial, you'll know how to embed R & Python scripts in T-SQL statements & know what data types are used to pass data between SQL & Python/R.",13
Sicelo Masango,"July 26th, 2018",Web Scraping using Python,"In this tutorial, you'll learn how to extract data from the web, manipulate and clean data using Python's Pandas library, and data visualize using Python's Matplotlib library.",147
Nishant Kumar,"July 25th, 2018",Working with Modules in Python,Modules enable you to split parts of your program in different files for easier maintenance and better performance.,24
Manish Pathak,"July 24th, 2018",Hierarchical Clustering in R,"Clustering is the most common form of unsupervised learning, a type of machine learning algorithm used to draw inferences from unlabeled data.",33
Sejal Jaiswal,"July 24th, 2018",Python List Index(),"In this tutorial, you will learn exclusively about the index() function.",23
Aditya Sharma,"July 20th, 2018",Autoencoder as a Classifier using Fashion-MNIST Dataset,"In this tutorial, you will learn & understand how to use autoencoder as a classifier in Python with Keras. You'll be using Fashion-MNIST dataset as an example.",16
Aditya Sharma,"July 19th, 2018",Detecting True and Deceptive Hotel Reviews using Machine Learning,"In this tutorial, you’ll use a machine learning algorithm to implement a real-life problem in Python. You will learn how to read multiple text files in python, extract labels, use dataframes and a lot more!",35
Eladio Montero Porras,"July 18th, 2018",Linear Regression in R,"In this tutorial, you will learn the basics behind a very popular statistical model; the linear regression.",55
Lars Hulstaert,"July 17th, 2018",Common data science pitfalls & how to avoid them!,"In this tutorial, you'll learn about some pitfalls you might experience when working on data science projects ""in the wild"".",18
Lars Hulstaert,"July 11th, 2018",Understanding Model Predictions with LIME,Learn about Lime and how it works along with the potential pitfalls that come with using it.,10
Filip Schouwenaars,"July 9th, 2018",Continuous deployment of package documentation with pkgdown and Travis CI,Follow these simple steps to enable continuous deployment of your package documentation.,9
Sayak  Paul,"July 5th, 2018",K-Means Clustering in Python with scikit-learn,Learn about the inner workings of the K-Means clustering algorithm with an interesting case study.,56
Aditya Sharma,"June 27th, 2018",Reconstructing Brain MRI Images Using Deep Learning (Convolutional Autoencoder),"In this tutorial, you'll learn & understand how to read nifti format brain magnetic resonance imaging (MRI) images, reconstructing them using convolutional autoencoder.",26
Michael Galarnyk,"June 27th, 2018",Setup a Data Science Environment on your Computer,"Learn about the various options you have to setup a data science environment with Python, R, Git, and Unix Shell on your local computer.",38
Aditya Sharma,"June 26th, 2018",Reconstructing Fingerprint Images Using Deep Learning (Convolutional Autoencoder),"In this tutorial, you will learn and understand how to read jpeg format fingerprint images, reconstructing them using convolutional autoencoder.",15
Debbie Liske,"June 21st, 2018",Machine Learning and NLP using R: Topic Modeling and Music Classification,"In this tutorial, you will build four models using Latent Dirichlet Allocation (LDA) and K-Means clustering machine learning algorithms.",60
Deepak Jhanji,"June 20th, 2018",Predicting the Status of H-1B Visa Applications,Learn how you can predict the status of a H-1B visa application with Machine Learning in Python.,16
James Le,"June 19th, 2018",Decision Trees in R,"Learn all about decision trees, a form of supervised learning used in a variety of ways to solve regression and classification problems.",51
Jason Graham,"June 12th, 2018",Using Python to Power Spreadsheets in Data Science,"Learn how Python can be used more effectively than Excel, with the Pandas package.",105
Tom Jeon,"June 8th, 2018",Converting Strings to Dates as datetime Objects,Learn how to convert strings to datetime objects in Python and why doing so has become standard practice for working data scientists today.,41
Thushan Ganegedara,"June 6th, 2018",TensorBoard Tutorial,"Visualize the training parameters, metrics, hyperparameters or any statistics of your neural network with TensorBoard!",39
Michael Galarnyk,"June 5th, 2018",Installing Anaconda on Mac OS X,"This tutorial will demonstrate how you can install Anaconda, a powerful package manager, on your Mac.",26
Steph Howson,"May 30th, 2018",Custom Templates for Jupyter Notebooks with Jinja2,Learn how to create custom export templates for your Jupyter Notebooks using Jinja2.,17
Michael Galarnyk,"May 23rd, 2018",How to Install and Use Homebrew,"Discover Homebrew for data science: learn how you can use this package manager to install, update, and remove technologies such as Apache Spark and Graphviz.",19
Avinash Navlani,"May 16th, 2018",Understanding Random Forests Classifiers in Python,"Learn about Random Forests and build your own model in Python, for both classification and regression.",63
Tom Jeon,"May 9th, 2018",Pandas Tutorial: Importing Data with read_csv(),Importing data is the first step in any data science project. Learn why today's data scientists prefer pandas' read_csv() function to do this.,75
Stefan Hosein,"May 9th, 2018",Demystifying Generative Adversarial Nets (GANs),Learn what Generative Adversarial Networks are without going into the details of the math and  code a simple GAN that can create digits!,53
Kim Kwonhyun,"May 8th, 2018",Long to Wide Data in R,Learn why you would transform your data from a long to a wide format and vice versa and explore how to do this in R with melt() and dcast()!,25
Francisco Lima,"April 26th, 2018",GFLASSO: Graph-Guided Fused LASSO in R,Explore graph-structured multi-task regression with the GFLASSO  R package with this tutorial!,11
Elias Dabbas,"April 24th, 2018",Absolute and Weighted Frequency of Words in Text,"In this tutorial, you'll learn about absolute and weighted word frequency in text mining and how to calculate it with defaultdict and pandas DataFrames.",13
Lars Hulstaert,"April 19th, 2018",A Beginner's Guide to Object Detection,"Explore the key concepts in object detection and learn how they are implemented in SSD and Faster RCNN, which are available in the Tensorflow Detection API.",67
Minoo Ashtiani,"April 17th, 2018",Network Analysis in R: Centrality Measures,"Explore the definition of centrality, learn what different types of centrality measures exist in network analysis and pick the best one for a given network!",43
James Le,"April 10th, 2018",Logistic Regression in R Tutorial,"Discover all about logistic regression: how it differs from linear regression, how to fit and evaluate these models it in R with the glm() function and more!",98
Hugo Bowne-Anderson,"April 10th, 2018",Getting Started with the Tidyverse: Tutorial,"Start analyzing titanic data with R and the tidyverse: learn how to filter, arrange, summarise, mutate and visualize your data with dplyr and ggplot2!",36
,"April 5th, 2018",Pickle in Python: Object Serialization,"Discover the Python pickle module: learn about serialization, when (not) to use it, how to compress pickled objects, multiprocessing, and much more!",86
Aditya Sharma,"April 4th, 2018",Implementing Autoencoders in Keras: Tutorial,"In this tutorial, you'll learn more about autoencoders and how to build convolutional and denoising autoencoders with the notMNIST dataset in Keras.",65
Debbie Liske,"March 29th, 2018",Tidy Sentiment Analysis in R,"Learn how to perform tidy sentiment analysis in R on Prince's songs, sentiment over time, song level sentiment, the impact of bigrams, and much more!",106
Théo Vanderheyden,"March 28th, 2018",Python Object-Oriented Programming (OOP): Tutorial,"Tackle the basics of Object-Oriented Programming (OOP) in Python: explore classes, objects, instance methods, attributes and much more!",169
Sejal Jaiswal,"March 14th, 2018",K-Means Clustering in R Tutorial,"Learn all about clustering and, more specifically, k-means in this R Tutorial, where you'll focus on a case study with Uber data.",100
Dror Atariah,"March 8th, 2018",From Local Machine to Dask Cluster with Terraform,Learn how you can take local code that does grid search with the Scikit-Learn package to a cluster of AWS (EC2) nodes with Terraform.,21
Manish Pathak,"March 7th, 2018",Feature Selection in R with the Boruta R Package,"Tackle feature selection in R: explore the Boruta algorithm, a wrapper built around the Random Forest classification algorithm, and its implementation!",37
Steph Howson,"March 6th, 2018",Python XML with ElementTree: Beginner's Guide,"Learn how you can parse, explore, modify and populate XML files with the Python ElementTree package, for loops and XPath expressions.",85
Hugo Bowne-Anderson,"February 28th, 2018",Experts' Favorite Data Science Techniques,"What are the most favorite techniques of the professional data scientists interviewed in DataFramed, a DataCamp podcast? Explore all 6 of them in this tutorial!",38
Alan Nichol,"February 28th, 2018",Deploy Your Facebook Messenger Bot with Python,"A step-by-step guide to easily deploying a Facebook Messenger chatbot with Python, using Flask, requests and ngrok. ",98
Arvid Kingl,"February 27th, 2018",Web Scraping in R: rvest Tutorial,"Explore web scraping in R with rvest with a real-life project: extract, preprocess and analyze Trustpilot reviews with tidyverse and tidyquant, and much more!",91
Daniel Poston,"February 22nd, 2018",Analyzing Poker Hands with Python,"Analyze poker hands with Python and easily implement statistical concepts such as combinations, permutations, (in)dependent events and expected value.",22
Daniel Gremmell,"February 20th, 2018",Ensemble Learning in R with SuperLearner,"Boost your machine learning results and discover ensembles in R with the SuperLearner package: learn about the Random Forest algorithm, bagging, and much more!",33
Svend Vanderveken,"February 14th, 2018",Generating Realistic Random Datasets with Trumania,"Why do data scientists and data engineers work with synthetic data? How do they obtain it? Discover Trumania, a scenario-based random dataset generator library.",26
Stefan Hosein,"February 9th, 2018",Active Learning: Curious AI Algorithms,"Discover active learning, a case of semi-supervised machine learning: from its definition and its benefits, to applications and modern research into it.",77
Johannes Mueller,"February 8th, 2018",Understanding Blockchains by Coding One in R,Implement a small blockchain in R  and learn more about what a blockchain looks like and some of the core concepts behind it!,142
Sejal Jaiswal,"February 7th, 2018",Python Tuples Tutorial,"Learn about Python tuples: what they are, how to create them, when to use them, what operations you perform on them and various functions you should know.",49
Alexis Perrier,"February 6th, 2018",Google Cloud for Data Science: Beginner's Guide,"Learn to set up a data science environment on Google Cloud: create an instance on Google Compute Engine, install Anaconda and run Jupyter notebooks!",79
Kasper Van Lombeek,"February 2nd, 2018",Finding Similar Names with Matrix Factorization,Applying matrix factorization on user clicks on hundreds of names on the recommender system NamesILike.com reveal an unseen structure in our first names.,19
Debbie Liske,"February 2nd, 2018",Lyric Analysis with NLP & Machine Learning with R,Dive into the lyrics of Prince's music with R: use text mining and Exploratory Data Analysis (EDA) to shed insight on The Artist's career. ,163
Elias Dabbas,"January 26th, 2018",Data Science for Search Engine Marketing (SEM),"In this tutorial, data science meets Search Engine Marketing: learn to create Google AdWords campaigns by generating keywords and ad templates with Python!",72
Chitrank Dixit,"January 25th, 2018",PEP-8 Tutorial: Code Standards in Python,"With this beginner tutorial, you'll start to explore PEP-8, Python's style guide, so that you can start formatting your code correctly to maximize its readability!",63
Sejal Jaiswal,"January 23rd, 2018",Python Iterator Tutorial,"Learn all about the Python iterator, how they differ from iterables and generators, and how to build one yourself with __iter__, __next__ and itertools.",12
Lars Hulstaert,"January 19th, 2018",Transfer Learning: Leverage Insights from Big Data,"In this tutorial, you’ll see what transfer learning is, what some of its applications are and why it is critical skill as a data scientist.",48
Sejal Jaiswal,"January 18th, 2018",Python String Tutorial,"In this tutorial, you'll learn all about Python Strings: slicing and striding, manipulating and formatting them with the Formatter class, f-strings, templates and more!",50
Hugo Bowne-Anderson,"January 17th, 2018",Time Series Analysis Tutorial with Python,Get Google Trends data of keywords such as 'diet' and 'gym' and see how they vary over time while learning about trends and seasonality in time series data.,116
Hugo Bowne-Anderson,"January 10th, 2018",Machine Learning with Kaggle: Feature Engineering,"Learn how feature engineering can help you to up your game when building machine learning models in Kaggle: create new columns, transform variables and more!",68
Alexis Perrier,"January 5th, 2018",8 Useful Shell Commands For Data Science,Which shell commands do data scientists use nearly every day? Discover and learn how to use them in this tutorial!,137
Hugo Bowne-Anderson,"January 3rd, 2018",Kaggle Tutorial: Your First Machine Learning Model,"Learn how to build your first machine learning model, a decision tree classifier, with the Python scikit-learn package, submit it to Kaggle and see how it performs! ",110
Hugo Bowne-Anderson,"December 21st, 2017",Kaggle Tutorial: EDA & Machine Learning,"In this Kaggle tutorial, you'll learn how to approach and build supervised learning models with the help of exploratory data analysis (EDA) on the Titanic data.",108
Nathaniel D. Phillips,"December 20th, 2017",Fast-and-Frugal Decision Trees in R with FFTrees,An introductory tutorial to fast-and-frugal decision trees in R with the FFTrees package. ,33
Simon Jackson,"December 13th, 2017",Five Tips to Improve Your R Code,"Five useful tips that you can use to effectively improve your R code, from using seq() to create sequences to ditching which() and much more!",125
Sejal Jaiswal,"December 12th, 2017",Python Dictionary Comprehension Tutorial,"Learn all about Python dictionary comprehension: how you can use it to create dictionaries, to replace (nested) for loops or lambda functions with map(), filter() and reduce(), ...!",82
Sejal Jaiswal,"December 8th, 2017",Python Data Structures Tutorial,"Get introduced to Python data structures: learn more about data types and primitive as well as non-primitive data structures, such as strings, lists, stacks, etc.",157
Michael Galarnyk,"December 6th, 2017",AWS EC2 Tutorial For Beginners,Discover why you should use Amazon Web Services Elastic Compute Cloud (EC2) and how you can set up a basic data science environment on a Windows instance.,61
Aditya Sharma,"December 5th, 2017",Convolutional Neural Networks in Python with Keras,"In this tutorial, you’ll learn how to implement Convolutional Neural Networks (CNNs) in Python with Keras, and how to overcome overfitting with dropout.",105
Karlijn Willems,"November 23rd, 2017",Formulas in R Tutorial,"Discover the R formula and how you can use it in modeling- and graphical functions of well-known packages such as stats, and ggplot2. ",80
Karlijn Willems,"November 16th, 2017",Pipes in R Tutorial For Beginners,"Learn more about the famous pipe operator %>% and other pipes in R, why and how you should use them and what alternatives you can consider!",165
Lars Hulstaert,"October 19th, 2017",LDA2vec: Word Embeddings in Topic Models,"Learn more about LDA2vec, a model that learns dense word vectors jointly with Dirichlet-distributed latent document-level mixtures of topic vectors.",75
Satyabrata Pal,"October 18th, 2017",Python Loops Tutorial,"A comprehensive introductory tutorial to Python loops. Learn and practice while and for loops, nested loops, the break and continue keywords, the range function and more!",65
Hugo Bowne-Anderson,"October 13th, 2017",Web Scraping & NLP in Python,"Learn to scrape novels from the web and plot word frequency distributions; You will gain experience with Python packages requests, BeautifulSoup and nltk.",114
Hugo Bowne-Anderson,"October 2nd, 2017","Hierarchical indices, groupby and pandas","In this tutorial, you’ll learn about multi-indices for pandas DataFrames and how they arise naturally from groupby operations on real-world data sets.",69
Hugo Bowne-Anderson,"September 26th, 2017","Groupby, split-apply-combine and pandas","In this tutorial, you'll learn how to use the pandas groupby operation, which draws from the well-known split-apply-combine strategy, on Netflix movie data.",110
Daniel Poston,"September 21st, 2017",Poker Probability and Statistics with Python,"Tackle probability and statistics in Python: learn more about combinations and permutations, dependent and independent events, and expected value.",67
Andrew Brooks,"September 12th, 2017",Graph Optimization with NetworkX in Python,This NetworkX tutorial will show you how to do graph optimization in Python by solving the Chinese Postman Problem in Python. ,73
Katharine Jarmul,"August 24th, 2017",Detecting Fake News with Scikit-Learn,This scikit-learn tutorial will walk you through building a fake news classifier with the help of Bayesian models. ,97
Karlijn Willems,"August 10th, 2017",Python Seaborn Tutorial For Beginners,This Seaborn tutorial introduces you to the basics of statistical data visualization ,135
Karlijn Willems,"July 28th, 2017",Apache Spark Tutorial: ML with PySpark,"Apache Spark tutorial introduces you to big data processing, analysis and ML with PySpark.",93
Daniel Poston,"June 20th, 2017",Scikit-Learn Tutorial: Baseball Analytics  Pt 2,A Scikit-Learn tutorial to using logistic regression and random forest models to predict which baseball players will be voted into the Hall of Fame,29
Karlijn Willems,"June 19th, 2017",The data.table R Package Cheat Sheet,"The data.table cheat sheet helps you master the syntax of this R package, and helps you to do data manipulations.",35
Yassine Alouini,"May 29th, 2017",5 Tips To Write Idiomatic Pandas Code,This tutorial covers 5 ways in which you can easily write pandorable or more idiomatic Pandas code. ,34
,"May 8th, 2017",Asyncio: An Introduction,A short introduction to asynchronous I/O with the asyncio package. ,15
Daniel Poston,"May 4th, 2017",Scikit-Learn Tutorial: Baseball Analytics Pt 1,A scikit-learn tutorial to predicting MLB wins per season by modeling data to KMeans clustering model and linear regression models. ,40
Juan  Nunez-Iglesias,"April 19th, 2017",Viewing 3D Volumetric Data With Matplotlib,"In this Python tutorial, you'll make use of Matplotlib's event handler API to display the slices of an MRI data set.  ",28
Yan Holtz,"April 14th, 2017",The R Graph Gallery's Top 5 Most Visited Graph Themes,A list of the 5 most popular graphs among R users and enthusiasts. ,12
Jean-Nicholas Hould,"April 13th, 2017",Exploratory Data Analysis of Craft Beers: Data Profiling,"In this tutorial, you'll learn about exploratory data analysis (EDA) in Python, and more specifically, data profiling with pandas.",33
Karlijn Willems,"March 28th, 2017",Apache Spark in Python: Beginner's Guide,"A beginner's guide to Spark in Python based on 9 popular questions, such as how to install PySpark in Jupyter Notebook, best practices,... ",126
Dan Becker,"March 23rd, 2017",Deep Learning With Jupyter Notebooks In The Cloud,This step-by-step tutorial will show you how to set up and use Jupyter Notebook on Amazon Web Services (AWS) EC2 GPU for deep learning. ,124
Karlijn Willems,"March 15th, 2017",Python Exploratory Data Analysis Tutorial,"Learn the basics of Exploratory Data Analysis (EDA) in Python with Pandas, Matplotlib and NumPy, such as sampling, feature engineering, correlation, etc.",114
Thomas Wielfaert,"February 16th, 2017",Python Dictionary Tutorial,"In this Python tutorial, you'll learn how to create a dictionary, load data in it, filter, get and sort the values, and perform other dictionary operations. ",27
Ted Kwartler,"February 9th, 2017",Algorithmic Trading in R Tutorial,"In this R tutorial, you'll do web scraping, hit a finance API and use an htmlwidget to make an interactive time series chart to perform a simple algorithmic trading strategy",30
Karlijn Willems,"February 8th, 2017",Scipy Tutorial: Vectors and Arrays (Linear Algebra),"A SciPy tutorial in which you'll learn the basics of linear algebra that you need for machine learning in Python, with a focus how to with NumPy.  ",27
Yao-Jen Kuo,"January 27th, 2017",Scikit-Learn 教學：Python 與機器學習,簡單易懂的 scikit-learn 教學，適合想要使用 Python 實作機器學習的初學者閱讀。,58
Ted Kwartler,"January 26th, 2017",Exploring H-1B Data with R: Part 3,Learn how to geocode locations and map them with R,7
Ted Kwartler,"January 19th, 2017",Exploring H-1B Data with R: Part 2,"Learn even more about exploratory data analysis with R in the second part of the ""Exploring H-1B Data"" tutorial series",5
Ted Kwartler,"January 12th, 2017",Web Scraping and Parsing Data in R |  Exploring H-1b Data Pt. 1,"Learn how to scrape data from the web, preprocess it and perform a basic exploratory data analysis with R ",17
Karlijn Willems,"January 10th, 2017",15 Easy Solutions To Your Data Frame Problems In R,"Discover how to create a data frame in R, change column and row names, access values, attach data frames, apply functions and much more.",55
Karlijn Willems,"December 5th, 2016",40+ Python Statistics For Data Science Resources,A list of Python resources for the eight statistics topics that you need to know to excel in data science,49
Karlijn Willems,"October 18th, 2016",Learn Data Science - Infographic,Start your data science journey now and follow these 8 steps to learn data science.,46
Karlijn Willems,"October 12th, 2016",Python For Data Science - A Cheat Sheet For Beginners,This handy one-page reference presents the Python basics that you need to do data science,43
