author,publishdate,title,description,upvote
Karlijn Willems,"September 21st, 2016",Learn Data Science - Resources for Python & R,"Data science resources you haven't considered (yet) - The best projects, tutorials, talks, podcasts, webinars, books, and much more to learn data science.",50
Ted Kwartler,"September 2nd, 2016",Text Mining in R: Are Pokémon GO Mentions Really Driving Up Stock Prices?,"Recreate your own news trends feature in R, mining Pokémon GO data from Google News Trends and Yahoo Finance.",6
Jacob Moody,"August 5th, 2016",Driving R Adoption in Your Company,Build a better R culture at your company with an internal meetup!,6
Hugo Bowne-Anderson,"May 10th, 2016",Preprocessing in Data Science (Part 3): Scaling Synthesized Data,You can preprocess the heck out of your data but the proof is in the pudding: how well does your model then perform?,13
Hugo Bowne-Anderson,"May 3rd, 2016","Preprocessing in Data Science (Part 2): Centering, Scaling and Logistic Regression",Discover whether centering and scaling help your model in a logistic regression setting.,24
Hugo Bowne-Anderson,"April 26th, 2016","Preprocessing in Data Science (Part 1): Centering, Scaling, and KNN",This article will explain the importance of preprocessing in the machine learning pipeline by examining how centering and scaling can improve model performance.,57
Karlijn Willems,"November 10th, 2015",The Data Science Industry: Who Does What (Infographic),"This infograph compares the roles of data scientists, data analysts, data architects, data engineers and more in the data science industry.",69
Filip Schouwenaars,"March 16th, 2015",Web Scraping with R and PhantomJS,Short tutorial on scraping Javascript generated data with R using PhantomJS.,27
Karlijn Willems,"March 4th, 2015",How to Speak Data Science,Data Science has its own language. This is a great list of often-heard data science terminology and quotes by Datacamp.,17
Karlijn Willems,"February 3rd, 2015","A data.table R Tutorial:  Intro to DT[i, j, by]",The free data.table R tutorial explains the basics and syntax of the data.table package for R. Master the data.table syntax now.,8
Karlijn Willems,"November 10th, 2014",Become A Data Scientist in 8 Steps: Infographic,This DataCamp infographic outlines how you can become a data scientist in 8 steps. This guide is for everyone interested in data science.,54
Karlijn Willems,"August 4th, 2014",The RDocumentation Poster,"Rdocumentation.org is the only R documentation and R manuals aggregator that lets you search everything from CRAN, Bioconductor and GitHub.",2
Karlijn Willems,"June 9th, 2014",Decimal Comma or Point? A googleVis visualization,Decimal comma or decimal point? A handy tool to indicate the decimal separator used in each country so you never make a mistake in your sheet,3
Karlijn Willems,"June 3rd, 2014",What Is the Best Statistical Programming Language? Infograph,"The infograph 'Statistical Language Wars' compares statistical programming language like SAS, R and SPSS to see how they stack up.",6
Karlijn Willems,"March 31st, 2014",Data Science Cartoons: a Top Seven List by DataCamp,The 7 funniest data science cartoons on the web selected by you. A selection made by DataCamp to celebrate April's fools day.,10
Karlijn Willems,"March 17th, 2014",R posts on Stack Overflow | A Top 5 selection by DataCamp,Stack Overflow is a useful resource for technical questions. At DataCamp we wanted to share our favourite R posts on Stack Overflow.,4
Karlijn Willems,"December 4th, 2013",Coursera Courses on R: Complete List Ranked by “Popularity”,"A list of all Coursera courses on R. These courses use R as their first choice, or as one of the statistical software packages for homework.",6
